{
  "captured_at": "2026-10-18T21:55:45.259420+00:00",
  "credential_digest": "sha256:b27033322a421fcdbf7c8a2f5347a34715a37b1798c3bda1cf1dd39e781909a3",
  "credential_source": "file:path:29f247d18d3c",
  "errors": [],
  "execution_host": "mac.lan",
  "identity": {
    "id": 6,
    "username": "spyroot",
    "web_url": "https://gitlab.dcloud.run/spyroot"
  },
  "kind": "gitlab_runner",
  "mutated": false,
  "operation": "list",
  "origin": "https://gitlab.dcloud.run",
  "phase": "READ",
  "plan": {
    "body_sha256": "ee82fa9a6ba20c28855daf0b147a43c3d69c5ad6fc676aa2953a363b510cb254",
    "confirmation_ready": true,
    "fields": [
      "description",
      "filters",
      "limit"
    ],
    "one_time_sink_required": false,
    "operation": "list",
    "plan_digest": "eee4c09511c4eb46b6f4cb054b2b8082b613a3ee5d61d5285e3ae63b95ac897c",
    "project_ids": null,
    "resource_id": null,
    "target_kind": "project",
    "target_reference": "hott/test"
  },
  "plan_digest": "eee4c09511c4eb46b6f4cb054b2b8082b613a3ee5d61d5285e3ae63b95ac897c",
  "readback": {
    "record_count": 1,
    "truncated": false,
    "verified": true
  },
  "records": [
    {
      "access_level": "not_protected",
      "architecture": null,
      "contacted_at": null,
      "description": "ci-skills-d1b2c6fb-20261018T215208Z-runner",
      "id": 95,
      "is_shared": false,
      "job_execution_status": "idle",
      "online": null,
      "paused": false,
      "platform": null,
      "projects": [
        124,
        123
      ],
      "runner_type": "project_type",
      "status": "never_contacted",
      "tag_list": [
        "ci-skills",
        "d1b2c6fb"
      ],
      "version": null
    }
  ],
  "related_job": null,
  "schema_version": "1.0",
  "skill": {
    "algorithm": "sha256-tree-v1",
    "consuming_project": {
      "commit": null,
      "source": null
    },
    "digest": "a034ab750654ed12a5eaffad51e5f48ef4aac8e99984aa7f601b69c9c8337631",
    "file_count": 218,
    "functional_digest": "9e28e57e6fbf4ea4e3de0ad155fd2d95bf2353bd7eb1503814ea9e81f301c07e",
    "revision": {
      "source": "installer_record",
      "value": "d1b2c6fb4e47836a68140873c220935463ebff81",
      "verified": true
    }
  },
  "status": "PASS",
  "summary": {
    "error_count": 0,
    "record_count": 1
  },
  "target": {
    "kind": "project",
    "reference": "hott/test"
  },
  "target_file": "path:d6e4cdad550e",
  "target_source": "project;argv:--project",
  "tested_revision": "d1b2c6fb4e47836a68140873c220935463ebff81",
  "verified_target": {
    "full_path": "hott/test",
    "id": 123,
    "kind": "project",
    "web_url": "https://gitlab.dcloud.run/hott/test"
  }
}
