{
  "captured_at": "2026-10-26T00:30:57.904756+00:00",
  "credential_digest": "sha256:b27033322a421fcdbf7c8a2f5347a34715a37b1798c3bda1cf1dd39e781909a3",
  "credential_source": "file:path:29f247d18d3c",
  "errors": [],
  "execution_host": "mac.lan",
  "identity": {
    "id": 6,
    "username": "spyroot",
    "web_url": "https://gitlab.dcloud.run/spyroot"
  },
  "kind": "gitlab_runner",
  "mutated": false,
  "operation": "get",
  "origin": "https://gitlab.dcloud.run",
  "phase": "READ",
  "plan": {
    "body_sha256": "62faba5c6b37436df73346dc65a66ecb29e36982b600db1c72fb9e21cf967e71",
    "confirmation_ready": true,
    "fields": [
      "description"
    ],
    "one_time_sink_required": false,
    "operation": "get",
    "plan_digest": "5048fddea85c19e97dca60542635dd7aa4156409a592ca5563ee050875435d08",
    "project_ids": null,
    "resource_id": 113,
    "target_kind": "project",
    "target_reference": "hott/test"
  },
  "plan_digest": "5048fddea85c19e97dca60542635dd7aa4156409a592ca5563ee050875435d08",
  "readback": {
    "record_count": 1,
    "truncated": false,
    "verified": true
  },
  "records": [
    {
      "access_level": "not_protected",
      "architecture": "amd64",
      "contacted_at": "2026-10-26T00:30:49.888Z",
      "description": "ci-skills-pr116-0486a761",
      "id": 113,
      "is_shared": false,
      "job_execution_status": "idle",
      "online": true,
      "paused": false,
      "platform": "linux",
      "projects": [
        123
      ],
      "runner_type": "project_type",
      "status": "online",
      "tag_list": [
        "ci-skills-pr116-0486a761"
      ],
      "version": "18.4.0"
    }
  ],
  "related_job": null,
  "schema_version": "1.0",
  "skill": {
    "algorithm": "sha256-tree-v1",
    "consuming_project": {
      "commit": null,
      "source": null
    },
    "digest": "84374b10f5e1f545f4910716837f603e8e078300d3973e1c132e7bab96b5a445",
    "file_count": 241,
    "functional_digest": "3f82a2a64b015cebbb095231679ffba5f0404db7448e39734b05f58f5e71cd58",
    "revision": {
      "source": "git_head",
      "value": "0486a7612e479eda207556b97ae885ffcaae2e6a",
      "verified": true
    }
  },
  "status": "PASS",
  "summary": {
    "error_count": 0,
    "record_count": 1
  },
  "target": {
    "kind": "project",
    "reference": "hott/test"
  },
  "target_file": "path:5e5380df1eda",
  "target_source": "env:CI_SKILLS_TARGET;argv:--project",
  "tested_revision": "0486a7612e479eda207556b97ae885ffcaae2e6a",
  "verified_target": {
    "full_path": "hott/test",
    "id": 123,
    "kind": "project",
    "web_url": "https://gitlab.dcloud.run/hott/test"
  }
}
