{
  "captured_at": "2026-10-18T13:55:19.744424+00:00",
  "credential_digest": "sha256:b27033322a421fcdbf7c8a2f5347a34715a37b1798c3bda1cf1dd39e781909a3",
  "credential_source": "file:path:29f247d18d3c",
  "errors": [],
  "execution_host": "mac.lan",
  "identity": {
    "id": 6,
    "username": "spyroot",
    "web_url": "https://gitlab.dcloud.run/spyroot"
  },
  "kind": "gitlab_runner",
  "mutated": false,
  "operation": "get",
  "origin": "https://gitlab.dcloud.run",
  "phase": "READ",
  "plan": {
    "body_sha256": "62faba5c6b37436df73346dc65a66ecb29e36982b600db1c72fb9e21cf967e71",
    "confirmation_ready": true,
    "fields": [
      "description"
    ],
    "one_time_sink_required": false,
    "operation": "get",
    "plan_digest": "30e0ceee64493bf2960ee5445dbdf43da0ad9b23ef98f73afcf3a23fb7c04698",
    "project_ids": null,
    "resource_id": 89,
    "target_kind": "project",
    "target_reference": "hott/test"
  },
  "plan_digest": "30e0ceee64493bf2960ee5445dbdf43da0ad9b23ef98f73afcf3a23fb7c04698",
  "readback": {
    "record_count": 1,
    "truncated": false,
    "verified": true
  },
  "records": [
    {
      "access_level": "not_protected",
      "architecture": null,
      "contacted_at": null,
      "description": "ci-skills-6ca1d777-20261018T135138Z-runner",
      "id": 89,
      "is_shared": false,
      "job_execution_status": "idle",
      "online": null,
      "paused": false,
      "platform": null,
      "projects": [
        124,
        123
      ],
      "runner_type": "project_type",
      "status": "never_contacted",
      "tag_list": [
        "ci-skills",
        "6ca1d777"
      ],
      "version": null
    }
  ],
  "related_job": null,
  "schema_version": "1.0",
  "skill": {
    "algorithm": "sha256-tree-v1",
    "consuming_project": {
      "commit": null,
      "source": null
    },
    "digest": "86eeff94d94240f04cad123064ac6cb233cc47182f66a2f685c4f010cd9cfda1",
    "file_count": 203,
    "functional_digest": "6e940688a3c787ca63728040f5445ec95376b6b6b240a456d420ecad406da080",
    "revision": {
      "source": "installer_record",
      "value": "6ca1d7778d07c417815618452b3dbee96170e8d5",
      "verified": true
    }
  },
  "status": "PASS",
  "summary": {
    "error_count": 0,
    "record_count": 1
  },
  "target": {
    "kind": "project",
    "reference": "hott/test"
  },
  "target_file": "path:a9d3a059049d",
  "target_source": "project;argv:--project",
  "tested_revision": "6ca1d7778d07c417815618452b3dbee96170e8d5",
  "verified_target": {
    "full_path": "hott/test",
    "id": 123,
    "kind": "project",
    "web_url": "https://gitlab.dcloud.run/hott/test"
  }
}
