{
  "captured_at": "2026-10-20T01:26:36.916464+00:00",
  "credential_digest": "sha256:b27033322a421fcdbf7c8a2f5347a34715a37b1798c3bda1cf1dd39e781909a3",
  "credential_source": "file:path:29f247d18d3c",
  "errors": [],
  "execution_host": "mac.lan",
  "identity": {
    "id": 6,
    "username": "spyroot",
    "web_url": "https://gitlab.dcloud.run/spyroot"
  },
  "kind": "gitlab_runner",
  "mutated": false,
  "operation": "get",
  "origin": "https://gitlab.dcloud.run",
  "phase": "READ",
  "plan": {
    "body_sha256": "62faba5c6b37436df73346dc65a66ecb29e36982b600db1c72fb9e21cf967e71",
    "confirmation_ready": true,
    "fields": [
      "description"
    ],
    "one_time_sink_required": false,
    "operation": "get",
    "plan_digest": "e8b630f3e090e32175062f6b54da8cc9e2cdcd9b03b028263802198647627845",
    "project_ids": null,
    "resource_id": 107,
    "target_kind": "project",
    "target_reference": "hott/test"
  },
  "plan_digest": "e8b630f3e090e32175062f6b54da8cc9e2cdcd9b03b028263802198647627845",
  "readback": {
    "record_count": 1,
    "truncated": false,
    "verified": true
  },
  "records": [
    {
      "access_level": "not_protected",
      "architecture": "amd64",
      "contacted_at": "2026-10-20T01:26:31.359Z",
      "description": "go-golangci-toolbox-20261020",
      "id": 107,
      "is_shared": false,
      "job_execution_status": "idle",
      "online": true,
      "paused": false,
      "platform": "linux",
      "projects": [
        123
      ],
      "runner_type": "project_type",
      "status": "online",
      "tag_list": [
        "go-golangci"
      ],
      "version": "18.4.0"
    }
  ],
  "related_job": null,
  "schema_version": "1.0",
  "skill": {
    "algorithm": "sha256-tree-v1",
    "consuming_project": {
      "commit": null,
      "source": null
    },
    "digest": "cabc9f9dc5878eabdc966e0e526246ca5f8935e14412ddfa2c11ef82a55ced4e",
    "file_count": 235,
    "functional_digest": "108bd1b30961c3e79762edd1ce686854ef25d16720f84b425fecc126c7dfa648",
    "revision": {
      "source": "git_head",
      "value": "92713cc9610b64f8ec7ba5ee141a99a38e63c9e9",
      "verified": true
    }
  },
  "status": "PASS",
  "summary": {
    "error_count": 0,
    "record_count": 1
  },
  "target": {
    "kind": "project",
    "reference": "hott/test"
  },
  "target_file": "path:5e5380df1eda",
  "target_source": "env:CI_SKILLS_TARGET;argv:--project",
  "tested_revision": "92713cc9610b64f8ec7ba5ee141a99a38e63c9e9",
  "verified_target": {
    "full_path": "hott/test",
    "id": 123,
    "kind": "project",
    "web_url": "https://gitlab.dcloud.run/hott/test"
  }
}
