{
  "captured_at": "2026-10-28T04:24:58.811593+00:00",
  "credential_digest": "sha256:b27033322a421fcdbf7c8a2f5347a34715a37b1798c3bda1cf1dd39e781909a3",
  "credential_source": "file:path:29f247d18d3c",
  "errors": [],
  "execution_host": "mac.lan",
  "identity": {
    "id": 6,
    "username": "spyroot",
    "web_url": "https://gitlab.dcloud.run/spyroot"
  },
  "kind": "gitlab_runner",
  "mutated": false,
  "operation": "get",
  "origin": "https://gitlab.dcloud.run",
  "phase": "READ",
  "plan": {
    "body_sha256": "62faba5c6b37436df73346dc65a66ecb29e36982b600db1c72fb9e21cf967e71",
    "confirmation_ready": true,
    "fields": [
      "description"
    ],
    "one_time_sink_required": false,
    "operation": "get",
    "plan_digest": "ac1e12cef9f092076de1b82af148497f4437088a20a96bf1281ef7918d28431e",
    "project_ids": null,
    "resource_id": 107,
    "target_kind": "project",
    "target_reference": "hott/test"
  },
  "plan_digest": "ac1e12cef9f092076de1b82af148497f4437088a20a96bf1281ef7918d28431e",
  "readback": {
    "record_count": 1,
    "truncated": false,
    "verified": true
  },
  "records": [
    {
      "access_level": "not_protected",
      "architecture": "amd64",
      "contacted_at": "2026-10-28T04:24:56.148Z",
      "description": "go-golangci-toolbox-20261020",
      "id": 107,
      "is_shared": false,
      "job_execution_status": "idle",
      "online": true,
      "paused": false,
      "platform": "linux",
      "projects": [
        123
      ],
      "runner_type": "project_type",
      "status": "online",
      "tag_list": [
        "go-golangci"
      ],
      "version": "18.4.0"
    }
  ],
  "related_job": null,
  "schema_version": "1.0",
  "skill": {
    "algorithm": "sha256-tree-v1",
    "consuming_project": {
      "commit": null,
      "source": null
    },
    "digest": "db2e08e801eda5e94575600d0f3724ed489c4eb49c9d5fe7715c0b7c26c90e2f",
    "file_count": 243,
    "functional_digest": "76882643c788ac6968171095973d69b21dc81c6937c5dd84efccd45d15f52aae",
    "revision": {
      "source": "installer_record",
      "value": "c6af254153190f96a78529c131f6aa434164ed80",
      "verified": true
    }
  },
  "status": "PASS",
  "summary": {
    "error_count": 0,
    "record_count": 1
  },
  "target": {
    "kind": "project",
    "reference": "hott/test"
  },
  "target_file": "path:5e5380df1eda",
  "target_source": "user;argv:--project",
  "tested_revision": "c6af254153190f96a78529c131f6aa434164ed80",
  "verified_target": {
    "full_path": "hott/test",
    "id": 123,
    "kind": "project",
    "web_url": "https://gitlab.dcloud.run/hott/test"
  }
}
